9764,12569763,Celik,"Nogometni klub Čelik Zenica is a professional football club based in Zenica, Bosnia and Herzegovina. The name Čelik means Steel in Bosnian and it symbolizes the strength and power of the club in an industrial city well-known for steel production.",Zenica,Bosnia and Herzegovina
10052,12569852,Vitez,"NK Vitez is football club based in Vitez, Bosnia and Herzegovina. The club plays in Second League of the Federation of Bosnia and Herzegovina - Center. The club's crest has the sword in front of a football ball. It also features the year when the club was established.",Vitez,Bosnia and Herzegovina
9197,12570117,Ironi Nesher,Ironi Nesher is an Israeli football club based in Nesher. They are currently in Liga Alef and play home matches at the Nesher Stadium.,Nesher,Israel
8669,12570818,Pogon Siedlce,"Miejski Klub Piłkarski Pogoń Siedlce  is a Polish football club based in Siedlce. The football team is currently playing in II liga. Pogoń plays their home games at new Municipal Stadium, which is situated on John Paul II Road in the town.",Siedlce,Poland
7467,12573102,Naftovik-Ukrnafta,"Football Club Naftovyk Okhtyrka is a Ukrainian amateur football club based in Okhtyrka, Sumy Oblast, where it was founded in 1980. The name of the club means ""oiler"" in Ukrainian. Ukrnafta company owned the club between 2004 and 2018.",Okhtyrka,Ukraine
10711,12573198,Zhemchuzhyna Odesa,"FC Zhemchuzhyna Odesa was a professional Ukrainian football from Odesa. The club was founded in 2013, but dissolved in 2018. The club was admitted to Ukrainian Second League in 2016–17 season. In its first season in it, the club became the champion and received promotion to the First League.",Odesa,Ukraine
290,12573204,Arsenal Kiev,"Football Club Arsenal Kyiv  is a Ukrainian football club based in Kyiv. In 2019 the club's professional team was dissolved, but its junior teams continue to compete in city competitions. The club claims to be a successor of Kyiv Arsenal factory team which traces its history back to 1925.",Kyiv,Ukraine
739,12576884,Rot-Weiß Erfurt,"FC Rot-Weiß Erfurt is a German association football club based in Erfurt, Thuringia.",Erfurt,Germany
11140,12584132,Real SC,Real Sport Clube is a Portuguese football club situated in Queluz that competes in the Liga 3. They were founded in 1951.,Queluz,Portugal
91,12591091,V. Manisaspor,"Manisaspor is a Turkish professional football club located in the city of Manisa. Originally formed in 1931 as Sakaryaspor, the club changed its name to Manisaspor on 15 June 1965. The club colours are red, white, and black. Manisaspor play their home matches at Manisa 19 Mayis Stadi.",Manisa,Turkey
11250,12597525,Gostaresh Foolad Tabriz,"Gostaresh Foulad Tabriz Football Club was an Iranian football club based in Tabriz, Iran. The club was founded in 2008. They were promoted to Persian Gulf Pro League in the 2012–13 season.",Tabriz,Iran
12569,12605702,Sanarate,"Deportivo Sanarate is a Guatemalan football club from Sanarate, El Progreso Department. It was founded in 1958 and currently plays in the Liga Nacional de Fútbol de Guatemala, top tier on their football.",Sanarate,Guatemala
8714,12606535,Soproni VSE,"Soproni VSE is a Hungarian football club in Sopron. The club's colours are purple and white. They won the Nemzeti Bajnokság II two times in 1945 and 1946, but they have never played in the first league.",Sopron,Hungaria
686,12606544,Gyor,"WKW ETO FC Győr or just ETO, is a football club from the city of Győr in Hungary. They are best known for reaching the semi-finals of the European Cup 1964-65. The club has won the Hungarian League four times.",Győr,Hungary
8358,12608025,FAR Rabat,"Association sportive des Forces armées royales, commonly known as AS FAR (Arabic: نادي الجيش الملكي), is a professional sport club based in Morocco's capital (Rabat-Salé), that competes in Botola, the top tier of Moroccan football.",Rabat-Salé,Morocco
12696,12608028,Racing de Casablanca,"Racing Athletic Club Casablanca is a Moroccan football club currently playing in the Botola 2. The club was founded in 1917 under the name of Racing Athlétic de Casablanca, but in 1969 the name was changed to Association des Douanes Marocains (ADM).",Casablanca,Morocco
11246,12612970,Afumati,"Club Sportiv Afumați, commonly known as CS Afumați or simply as Afumați, is a Romanian football club based in Afumați, Ilfov County, currently playing in the Liga III.",Afumați,Romania
12629,12612971,Stiinta Miroslava,"Clubul Sportiv Știința Miroslava, commonly known as Știința Miroslava or simply as Miroslava, is a football club from Romania, based in Miroslava, Iași County and founded in 2009 the club is currently playing in the Liga III.",Miroslava,Romania
12623,12612975,Foresta,"Asociația Club Sportiv Foresta Suceava, commonly known as Foresta Suceava or simply as Foresta, is a professional football club from Romania, based in Suceava, Suceava County and founded in 1946 as Locomotiva Ițcani. Previously, the club changed its name to A.S. C.F.R. Ițcani as well.",Suceava,Romania
12686,12613604,Pivara,"Fudbalski klub ČSK Pivara is a football club from Čelarevo, a village near Bačka Palanka, Serbia. It was founded in 1925 as ČOSK (Serbian: Čebski Omladinski Sportski Klub or ЧОСК, Чебски Омладински Спортски Клуб). The village of Čelarevo was called Čeb before World War II, hence the name.",Čelarevo,Serbia
12659,12613722,Zarzis,Esperance Sportive de Zarzis is a football club from Zarzis in Tunisia and founded in 1934 by Haj Ali Bouchhioua .,Zarzis,Tunisia
12842,12617693,Fajr Sepasi,"Fajr Shahid Sepasi Shiraz Football Club, commonly known as Fajr Sepasi Shiraz, or Fajr Sepasi, is an Iranian football club based in Shiraz, Fars, that competes in the Persian Gulf Pro League. The club was founded in 1988.",Shiraz,Iran
78,12621121,Lecce,"Union Sportiva Lecce, commonly referred to as Lecce (Italian pronunciation: [ˈlettʃe]), is an Italian football club based in Lecce, Apulia. The club will play in Serie A in the 2022–23 season, the top level of the Italian football pyramid, having been promoted from Serie B.",Lecce,Italy
9883,12621408,Mestre,"Associazione Calcio Mestre is an Italian association football club located in Mestre, Venice, Veneto. It currently plays in Serie D, the fourth tier of the Italian league system. Its colors are orange and black.",Mestre,Italy
8587,12621487,Bassano Virtus,"Bassano Virtus 55 Soccer Team S.p.A., commonly known as Bassano Virtus or just Bassano is a football club based in Bassano del Grappa, Veneto. The first team of the club was relocated to Vicenza in 2018 as L.R.",Bassano del Grappa,Italy
8469,12621808,Prato,"Associazione Calcio Prato is an Italian association football club, based in Prato, Tuscany. Prato currently plays in Serie D/E, having last been in Serie B in 1964.",Prato,Italy
10921,12621819,Fondi,"S.S. Racing Club Fondi was an Italian football club, based in Fondi, Lazio. The club previously known as Unicusano Fondi and Fondi Calcio. In 2018, the club merged with F.C. Aprilia.",Fondi,Italy
12742,12621845,US Gavorrano,"Unione Sportiva Follonica Gavorrano is an Italian association football club that represents the municipalities of Follonica and Gavorrano in Tuscany, the latter is also the company headquarters. The club currently play in Serie D, the fourth tier of Italian football.",Follonica,Italy
9425,12621855,Santarcangelo,"Santarcangelo Calcio is an Italian association football club, based in Santarcangelo di Romagna, Emilia-Romagna. The club didn't sign up for the Eccellenza in 2019 and so dissolved.",Santarcangelo di Romagna,Italy
9001,12621877,Cosenza,"Cosenza Calcio S.r.l. is an Italian football club, based in Cosenza, Calabria. Currently the team plays in Serie B. Found in 2011 as Nuova Cosenza Calcio as the phoenix club of Cosenza Calcio 1914 S.r.l., the spiritual successor of the original Cosenza Calcio 1914 S.p.A. which folded in 2005.",Cosenza,Italy
9204,12633248,Al Nasr Cairo,"Al Nasr Sporting Club, is an Egyptian football club based in Cairo, Egypt. The club is currently playing in the Egyptian Second Division, the second highest league in the Egyptian football league system.",Cairo,Egypt
7576,12637778,Al Faisaly Amman,"Al-Faisaly Sports Club is a professional football club based in Amman, Jordan, that competes in the Jordanian Pro League, the top flight of Jordanian football. Nicknamed ""the Blue Eagles"", they were founded as Al-Ashbal Club in 1932.",Amman,Jordan
12819,12637791,Al Yarmouk,Al-Yarmouk is a Kuwaiti professional sports club located in the district of Mishref. It was established on 28 February 1965 in Failaka Island and was the only Kuwaiti club to have been established outside mainland Kuwait at that time.,Mishref,Kuwait
12824,12637793,That Ras,That Ras is a football club based in Al Karak which competes in the Jordan League.,Al Karak,Jordan
9668,12640732,PAE Chania,"Chania Football Club is a Greek professional football club based in Chania, Crete, Greece. They were established in 2017, as a result of a merger between the two regional clubs representing the Chania district in the Greek Second Division, PGS Kissamikos and AO Chania.",Chania,Greece
8859,12640936,Karditsa,"Anagennisi Karditsa Football Club is a Greek professional football club based in Karditsa, Greece, which competes in the Super League 2, the second tier of the Greek football league system.",Karditsa,Greece
10335,1378992,Grankulla IFK,"Grankulla IFK, or GrIFK as the name is commonly abbreviated, is a Finnish sports club from the city of Kauniainen.  The club was formed in 1925 and the main activities covered are football, ice-hockey, handball and floorball.",Kauniainen,Finland
13894,1379014,Kiffen,"Kronohagens Idrottsförening (English: Kruununhaka Sports Association) is a sports club from Helsinki, Finland. The club was founded on 27 September 1908, and has been mainly known for the achievements of its association football and handball teams.",Helsinki,Finland
15121,1379080,Kiisto,"FC Kiisto is a Finnish football club, based in the city of Vaasa. It currently plays in Kolmonen (Third Division).",Vaasa,Finland
9508,1379098,Vaajakoski,FC Vaajakoski is an active sports club from Jyväskylä in Finland.  The club was formed in 1993 and their home ground is at the Vaajakosken keskuskenttä.  The men's first team currently plays in the Kakkonen (Second Division).  The Chairman of FCV is Laasi Paavolainen.,Jyväskylä,Finland
17390,1379106,Pargas,"Pargas Idrottsförening, or PIF for short, is a sports club based in the city of Pargas, Finland. The club has over 1,500 members and is known, especially for handball, football, and orienteering. It also makes provision for cross-country skiing, floorball, gymnastics, and athletics.",Pargas,Finland
9242,1379205,GBK,"Gamlakarleby Bollklubb is a Finnish football club from Kokkola (Gamlakarleby in Swedish). It currently plays in the Finnish Second Division (Kakkonen), which is the third-highest level in Finnish football.",Kokkola,Finland
13898,1379230,NJS,"Nurmijärven Jalkapalloseura is a football club from Nurmijärvi, Finland. The club was formed in 2004 following the amalgamation of Nurmijärven Nateva and FC Nurmijärvi.  The club's home ground is at the sports area of Klaukkala (Klaukkalan urheilualue).",Nurmijärvi,Finland
17389,1379260,Kultsu,"Kultsu FC is a football club from Joutseno, Lappeenranta, Finland. The club was formed in 1941. Kultsu FC play their home matches at Joutsenon keskuskenttä. The team currently plays in the Kolmonen, fourth tier in Finland.",Joutseno,Finland
13899,1379328,JBK,"Jakobstads BK, also known as JBK, is a Finnish soccer team from Jakobstad currently playing in Kakkonen, a third tier soccer league in Finland. The club's home venue is Västra plan.",Kakkonen,Finland
9268,1379338,PK-35 Vantaa,"PK-35 Vantaa may refer to:  PK-35 Vantaa, a Finnish women's football club in the Kansallinen Liiga PK-35 Vantaa (men), a former Finnish men's football team (2008–2016).",Vantaa,Finland
13562,1379339,PKKU,"Pallokerho Keski-Uusimaa is a football club serving the sub-region of Keski-Uusimaa in Finland and is centred on the towns of Järvenpää, Kerava and Tuusula.  The club was formed in 2005 and the men's first team currently plays in the Kakkonen (Second Division).",Järvenpää,Finland
13563,1379345,Klubi-04,Klubi 04 is a Finnish football club based in Helsinki. It is the reserve team of Helsingin Jalkapalloklubi for whom a number of the players are also registered.,Helsinki,Finland
13896,1379349,JIPPO,"JIPPO is a Finnish football club, based in Joensuu. It plays in the Kakkonen, the third highest level of Finnish football. Jippo plays its home matches at Mehtimäki, Joensuu.",Joensuu,Finland
15276,1399816,Lahden Reipas,"Reipas Lahti is a sports club based in Lahti, Finland. It is involved in various of ball games and also other sports. The club emerged in the late 1940s, when the inhabitants of Viipuri had mostly been relocated in Lahti, after evacuation during World War II.",Lahti,Finland
13561,1399832,TPV,"Tampereen Pallo-Veikot is a Finnish football club, based in Tampere. The club plays in the Kakkonen, the third highest level of football in Finland. It is the second largest football club in the Pirkanmaa region in terms of active members, with 1,600 members in 2005.",Tampere,Finland
9257,1399833,VIFK,"Vasa IFK is a Finnish football club, located in Vaasa. It was founded in 1900. The club changed its name in 1988 after a merger with another club, BK-48, and was called BK-IFK during the late 1900s. The name was changed back to VIFK in year 2000.",Vaasa,Finland
13895,1399835,SalPa,Salon Palloilijat is a sports club from Salo in Finland.  The club is popularly known as  The Swans.  SalPa was formed in 1956 and their home ground is at the Salon Urheilupuisto.  The men's football first team currently plays in the Kakkonen (Second Division).  The Chairman of SalPa is Toni Tammi.,Salo,Finland
13922,1404647,Floresti,"FC Florești  is a Moldovan football club based in Florești, Moldova. They played in the Moldovan National Division, the first tier of Moldovan football, in its most recent season, but were relegated after finishing 8th in the 2021-22 season.",Florești,Moldova
668,1404671,Zimbru Chisinau,"Fotbal Club Zimbru, known as Zimbru Chișinău, is a Moldovan professional football club based in Chișinău, which competes in the Divizia Națională, the highest tier of Moldovan football.",Chișinău,Moldova
9020,1404673,Petrocub,"FC Petrocub Hîncești is a Moldovan football club from Hîncești, Moldova. They play in the Divizia Națională, the top division in Moldovan football. Its home ground is Municipal Stadium.",Hîncești,Moldova
9458,1404679,Codru Lozova,"FC Codru Lozova  was a Moldovan football club based in Lozova, Moldova. The club spent two seasons in the Moldovan National Division, the first tier of Moldovan football.",Lozova,Moldova
8055,1404688,Dinamo-Auto,"FC Dinamo-Auto is a Moldovan football club from Tiraspol, Moldova, playing in the village of Tîrnauca, Slobozia. They play in the Moldovan National Division, the highest tier of Moldovan football.",Tîrnauca,Moldova
232,1404689,Sheriff Tiraspol,"Fotbal Club Sheriff, commonly known as Sheriff Tiraspol or simply Sheriff, is a Moldovan professional football club based in Tiraspol, a city located in the unrecognised breakaway state of Transnistria.",Transnistria,Moldova
9028,1404692,Dacia Buiucani,"Dacia Buiucani is a Moldovan football club from the Buiucani sector of Chișinău. The club competes in the Moldovan ""A"" Division, the second tier of Moldovan football. The academy of the club is called CSCT Buiucani.",Chișinău,Moldova
729,1407029,Dudelange,"F91 Dudelange, or F91 Diddeleng, is a Luxembourger professional football club based in Dudelange which plays in the Luxembourg National Division. It was formed in 1991 as a merger between three teams in the city —  Alliance Dudelange, Stade Dudelange and US Dudelange.",Dudelange,Luxembourg
9279,1407054,Progres Niedercorn,"Football Club Progrès Niederkorn is a football club based in Niederkorn, in south-western Luxembourg.",Niederkorn,Luxembourg
7961,1407065,Differdange 03,"Foussballclub Differdange 03 is a football club based in Differdange, Luxembourg.",Differdange,Luxembourg
12632,1407067,US Hostert,"Football Club Union Sportive Hostert A.s.b.l. is a football club, based in Hostert, Niederanven, in central Luxembourg. In 2011, the club was promoted to the highest tier for the first time in its history. The club is also a home to many youth teams.",Hostert,Luxembourg
9045,1407068,Etzella,"Foussballclub Etzella Ettelbréck, abbreviated to either FC Etzella or Etzella Ettelbruck, is a football club, based in Ettelbruck, in north-eastern Luxembourg.",Ettelbruck,Luxembourg
12638,1407072,FC Rodange 91,"FC Rodange 91 is a football club based in Rodange, Luxembourg.",Rodange,Luxembourg
12937,1407075,Racing Union,"Racing Fussball Club Union Luxembourg, usually abbreviated to Racing-Union, is a football club, based in Luxembourg City, in southern Luxembourg.",Luxembourg City,Luxembourg
10456,1407076,Petange,"Club Sportif Pétange is a former football club, based in Pétange, in south-western Luxembourg. In 2015 it folded and merged with FC Titus Lamadelaine to form Union Titus Pétange.",Pétange,Luxembourg
8013,1407079,Fola Esch,"Sporting Circle Fola Esch, usually abbreviated to Fola Esch or simply Fola, is a football club, based in Esch-sur-Alzette, in south-western Luxembourg. They play their home games at Stade Émile Mayrisch, in the south of the city, which they share with their sister athletics club CA Fola Esch.",Esch-sur-Alzette,Luxembourg
14854,14071782,Veranopolis,"Veranópolis Esporte Clube Recreativo e Cultural, commonly referred to as Veranópolis, is a Brazilian football club based in Veranópolis, Rio Grande do Sul. It currently plays in Campeonato Gaúcho Série A2, the second level of the Rio Grande do Sul state football league.",Veranópolis,Brazil
9146,14072269,Tupi,"Tupi Football Club, commonly referred to as Tupi, is a Brazilian professional club based in Juiz de Fora, Minas Gerais founded on 26 May 1912. It competes in the Campeonato Mineiro Módulo II, the second tier of the Minas Gerais state football league.",Juiz de Fora,Brazil
14878,14073649,Rio Negro AM,"Atlético Rio Negro Clube, usually known simply as Rio Negro is a traditional Brazilian football club from Manaus, Amazonas state. Rio Negro is the second oldest club of Amazonas state, and is eleven months younger than its rival, Nacional.",Manaus,Brazil
9010,14074110,Trelleborgs FF,"Trelleborgs Fotbollsförening, more commonly known as Trelleborgs FF or simply Trelleborg, is a Swedish football club located in Trelleborg. Formed 6 December 1926, the club plays in Superettan, the second tier in the Swedish Football system.",Trelleborg,Sweden
8981,14074112,Norrby,"Norrby IF is a professional football club from Borås, Sweden. The club was founded on 27 April 1927 and currently competes in the Superettan.",Borås,Sweden
7713,14074113,Degerfors,"Degerfors IF is a Swedish football club located in Degerfors. The club, formed 13 January 1907, is currently playing in the highest tier in Swedish football, Allsvenskan.",Degerfors,Sweden
8766,14074254,IK Frej,"IK Frej is a Swedish sports club located in Täby kyrkby. It currently plays in Division 4, the sixth tier in Swedish football.",Täby kyrkby,Sweden
10311,14075738,KFUM Oslo,"KFUM-Kameratene Oslo is the sports branch of the local YMCA in Oslo, Norway. It has sections for association football, futsal, volleyball and track and field. The football team currently plays in 1. divisjon, the second tier of the Norwegian football league system.",Oslo,Norway
674,14079857,Vestmannaeyjar,"Íþróttabandalag Vestmannaeyja is an Icelandic multi-sports district association from Vestmannaeyjar off the south coast of Iceland. It was founded in 1903 as Fótboltafélag Vestmannaeyja by Björgúlfur Ólafsson, military doctor for the Dutch army.",Vestmannaeyjar,Iceland
7544,14079916,Valur,Valur may refer to:.," Reykjavík",Iceland
6936,14080730,WIT Georgia,"FC WIT Georgia is a Georgian football team from Tbilisi. The team is sponsored by WIT Georgia Ltd (a subsidiary of the United States WIT, Inc.), a pet food, accessories, and human and veterinary pharmaceuticals import company. WIT stands for World Innovation Technologies.",Tbilisi,Georgia
6933,14080738,Sioni,"FC Sioni is a Georgian football club based in Bolnisi. Following the 2021 season, they won Liga 2 and gained promotion to the first tier of Georgian league system. The team has once claimed the national league champion's title.",Bolnisi,Georgia
7856,14081184,Gifu,"Football Club Gifu, abbreviated as F.C. Gifu is a Japanese football club based in Gifu, Japan. They play in the J3 League, the third tier of Japanese professional football. They also run a reserve team that play in the Tōkai Adult League Division 1.",Gifu,Japan
13723,14081191,Kagoshima United,"Kagoshima United FC is a football club in Japan that was formed from the merger of Volca Kagoshima and FC Kagoshima, both have been playing in Kyushu Soccer League before the merger. Their top team currently plays in J3 League, and their secondary team plays in Kyushu Soccer League.",Kyushu,Japan
13570,14081560,Club Destroyers,"Club Destroyers is a football club from Santa Cruz, Bolivia currently playing in the second division Copa Simón Bolívar. The club was founded September 14, 1948, and they play their home games at the Estadio Ramón Tahuichi Aguilera."," Santa Cruz"," Bolivia"
14103,1408227,Trajal Krusevac,"Fudbalski klub Trayal is a professional football club from Kruševac, Serbia. They currently compete in the Serbian League East, the third tier of the national league system.",Kruševac,Serbia
13796,14083113,LALA,"Asociación Civil LALA Fútbol Club is a Venezuelan football club based in Ciudad Guayana, which played in the Venezuelan Primera División between the 2019 and 2021 seasons. It was founded in 2011 and plays its home matches at the Polideportivo Cachamay.",Ciudad Guayana,Venezuela
11407,14083116,Estudiantes Caracas,"Estudiantes de Caracas Sport Club is a Venezuelan professional football club based in Caracas. It was established as a professional team in July 2014, debuting in the Venezuelan Segunda División for the 2014–15 season and earning promotion to the top tier at the end of that season.",Caracas,Venezuela
8945,1408315,Sloga Kraljevo,"Fudbalski klub Sloga Kraljevo is a football club based in Kraljevo, in Serbia.",Kraljevo,Serbia
10726,14083168,Deportivo Lara,"Asociación Civil Deportivo Lara is a professional football club based in Cabudare, Lara State, that was promoted to the Venezuelan league in 2009, in their first year of existence.",Cabudare,Venezuela
15712,1408336,Graficar,"RFK Grafičar Beograd is a football club based in Belgrade, Serbia. Grafičar has a reputation as an old traditional Belgrade club. Initially, it was financed by the printing industry of major city publishers of books, magazines and newspapers.",Belgrade,Serbia
14102,1408338,Zarkovo,"OFK Žarkovo is a professional football club based in Žarkovo, Belgrade, Serbia. They compete in the Serbian First League, the second tier of the national league system.",Belgrade,Serbia
15713,1408339,Kabel Novi Sad,"FK Kabel is a professional football club based in Novi Sad, Vojvodina, Serbia. They compete in the Serbian First League, the second tier of the national league system.",Novi Sad,Serbia
18717,1408340,Loznica,"FK Loznica is a professional football club from Loznica, Serbia.",Loznica,Serbia
8990,1408342,Borac,"Fudbalski klub Borac Čačak, or simply Borac Čačak, is a professional football club based in Čačak, Serbia. The home ground is Čačak Stadium, which has seating capacity of 8,000. As of 2019–20 season, the club competes in third tier Serbian League West.",Čačak,Serbia
12687,1408343,Buducnost Dobanovci,"FK Budućnost Dobanovci is a professional football club based in Dobanovci, Belgrade, Serbia. They currently compete in the Serbian First League, the second tier of the national league system.",Belgrade,Serbia
15714,1408344,Kolubara,"FK Kolubara is a professional football club based in Lazarevac, Serbia, Serbia. They compete in the Serbian SuperLiga, the top tier of the national league system.",Belgrade,Serbia
12404,1408345,Zemun,"Fudbalski klub Zemun is a Serbian professional football club based in Zemun, Belgrade, that competes in the Serbian First League.",Belgrade,Serbia
673,1408346,Jagodina,"Fudbalski klub Jagodina is a Serbian professional football club based in the city of Jagodina, which plays in the Serbian First League, the second tier in Serbia's football league. The club was founded in 1919 under the name JSK Zora, just months after the end of World War I.",Jagodina,Serbia
12405,1408718,Macva,"Fudbalski klub Mačva Šabac is a football club from Šabac, Serbia. One of the oldest football clubs in Serbia, their nickname is Provincijski Urugvaj (The Provincial Uruguay).",Šabac,Serbia
7427,1408724,Javor Ivanjica,"FK Javor Ivanjica is a professional football club based in Ivanjica, Serbia. They compete in the Serbian SuperLiga, the top tier of the national league system.",Ivanjica,Serbia
7488,14093721,TPS,"Turun Palloseura, commonly known as TPS, is a professional football club based in Turku, Finland.",Turku,Finland
707,1409872,Slavia Sofia,"PFC Slavia Sofia is a Bulgarian professional association football club based in Sofia, which currently competes in the top tier of the Bulgarian football league system, the First League. Slavia's home ground is the Slavia Stadium in Ovcha kupel with a capacity of 25,556.",Sofia,Bulgaria
