8665,1442199,Hapoel Nof HaGalil,"Hapoel Nof HaGalil Football Club is an Israeli football club based in the city of Nof HaGalil, Formally known by the name ""Nazareth Illit"" until 2019 (The club accordingly was named as Hapoel Nazareth Illit F.C). The club currently plays in Liga Leumit.",Nof HaGalil,Israel
11296,1442201,Kfar Kasem,"F.C. Kafr Qasim is an Israeli football club based in Kafr Qasim. The club currently plays in Liga Leumit, they play home matches at the Lod Municipal Stadium in Lod.",Kafr Qasim,Israel
8247,1442205,Maccabi Ahi,Maccabi Ahi Nazareth Football Club is an Israeli football club based in Nazareth. The club is currently in the Liga Leumit and plays at the Ilut Stadium in Ilut on the outskirts of the city.,Nazareth,Israel
11300,1442207,Hapoel Iksal Imad,Hapoel Iksal is an Israeli football club based in Iksal. The club currently plays in Liga Leumit.,Iksal,Israel
15882,1442208,Hapoel Umm al-Fahm,Hapoel Umm al-Fahm Football Club is an Israeli football club based in Umm al-Fahm. The club currently plays in the Liga Leumit.,Umm al-Fahm,Israel
8562,1443065,SKU Amstetten,SKU Amstetten are an Austrian association football club founded in 1997 playing in Amstetten.," Amstetten",Austria
12489,1443066,Vorwarts Steyr,SK Vorwärts Steyr is an Austrian association football club based in Steyr. It was founded in 1919. They play at the Vorwärts Stadium. Currently the club has about 300 members. Is one of the oldest football clubs in Upper Austria.,Steyr,Austria
573,1443068,Kapfenberg,Kapfenberger SV is an Austrian association football club from Kapfenberg. They won the 2007–08 Austrian Football First League and advanced to the Austrian Bundesliga. The club was founded in 1919 as Kapfenberger SC.,Kapfenberg,Austria
7481,1443069,Horn,"SV Horn is an Austrian association football club playing in the city of Horn. The club plays in the Austrian Second League. The team was champion of the Landesliga Niederösterreich in 1991, 1998 and 2007. In 2008, SV Horn won the Austrian Cup by beating SV Feldkirchen in the final.",Horn,Austria
7502,1443073,Juniors OÖ,"FC Juniors OÖ is an Austrian association football club, from Pasching, Upper Austria. It was newly founded after the move of ASKÖ Pasching, who last appeared as FC Superfund, to Carinthia and the associated renaming in SK Austria Kärnten in 2007 as FC Superfund Pasching.",Pasching,Austria
593,1443075,BW Linz,FC Blau-Weiß Linz or BW Linz are an Austrian association football club playing in the Second League in the current 2020–21 season.,Linz,Austria
8196,1443352,Wehen,"SV Wehen Wiesbaden is a German association football club based in Wiesbaden, Hesse. Since the beginning of the 2007–08 season the club no longer plays its home games in Taunusstein, where they were originally located. In the summer of 2007 Wiesbaden was added to the original name of SV Wehen.",Wiesbaden,Germany
8211,1443355,Waldhof Mannheim,"SV Waldhof Mannheim is a multi-sports club, located in Mannheim, Baden-Württemberg. It is most known for its association football team; however, there are also professional handball and table-tennis sides. The club today has a membership of over 2,400.",Mannheim,Germany
9859,1443442,Bayern Munchen II,"Bayern Munich II are the reserve team of German association football club Bayern Munich, they currently play in the Regionalliga Bayern. In 2010–11 they played in the 3."," Munich",Germany
15594,1443444,Türkgücü-Ataspor München,"Türkgücü München is a German association football club from the city of Munich, Bavaria. The club, which is based in the Turkish community of Munich, was formed in 2009 in a merger of Türkischer SV 1975 München and ATA Spor München.",Munich,Germany
8503,1443445,Verl,"SC Verl is a German association football club based in Verl, North Rhine-Westphalia. The club was founded on 6 September 1924, and since 1970 has consistently played in the higher echelons of amateur football. The club was promoted to the professional 3. Liga in 2020.",Verl,Germany
699,1443448,Duisburg,"Meidericher Spielverein 02 e. V. Duisburg, commonly known as simply MSV Duisburg (German pronunciation: [ʔɛm ʔɛs faʊ ˈdyːsbʊɐ̯k]), is a German association football club based in Duisburg, North Rhine-Westphalia.",Duisburg,Germany
8086,1443449,1. FC Saarbrücken,"1. FC Saarbrücken is a football club based in Saarbrücken, Saarland. The club plays in the 3. Liga, which is the third tier of football in Germany. The club began its existence as the football department of Turnverein Malstatt formed in 1903.",Saarbrücken,Germany
8965,1443450,Zwickau,"FSV Zwickau is a German association football club located in Zwickau, Saxony. Today's club claims as part of its complex heritage sides that were East Germany's first champions: 1948 Ostzone winners SG Planitz and 1950 DDR-Oberliga champions ZSG Horch Zwickau.",Zwickau,Germany
166,1443451,Unterhaching,"Spielvereinigung Unterhaching is a German sports club in Unterhaching, a semi-rural municipality on the southern outskirts of the Bavarian capital Munich.",Unterhaching,Germany
687,1443452,Munich 1860,"Turn- und Sportverein München von 1860, commonly known as TSV 1860 München (German pronunciation: [ˌteːʔɛsˈfaʊ ˌʔaxtseːnˈhʊndɐt ˈzɛçtsɪç ˈmʏnçn̩]; lettered as Achtzehnhundertsechzig München) or 1860 Munich, is a sports club based in Munich.",Munich,Germany
632,1443453,Hansa Rostock,"FC Hansa Rostock is a German association football club based in the city of Rostock, Mecklenburg-Vorpommern. They have emerged as one of the most successful clubs from the former East Germany after German reunification and have made several appearances in the top-flight Bundesliga.",Rostock,Germany
8468,1443455,Meppen,"SV Meppen is a German association football club playing in Meppen, Lower Saxony. The club was founded on 29 November 1912 as Amisia Meppen and joined Männer-Turnverein Meppen on 8 February 1920 to form TuS Meppen 1912.",Meppen,Germany
267,1443456,Kaiserslautern,"1. Fußball-Club Kaiserslautern e. V., also known as 1.",Kaiserslautern,Germany
9429,1443457,Lubeck,"VfB Lübeck is a German association football club playing in Lübeck, Schleswig-Holstein in the country's north. In addition to its football side the 1,000 member sports club also has departments for badminton, women's gymnastics, handball, and table tennis.",Lübeck,Germany
7476,1445239,Northampton Town,"Northampton Town Football Club is a professional association football club based in the town of Northampton, England. The team plays in EFL League Two, the fourth tier of the English football league system.",Northampton,England
8502,1445256,Plymouth Argyle,"Plymouth Argyle Football Club is a professional football club based in the city of Plymouth, Devon, England. As of the 2021–22 season, the team are competing in League One, the third tier of English football. They have played at Home Park, known as the ""Theatre of Greens"", since 1901.",Plymouth,England
7495,1445298,Swindon Town,"Swindon Town Football Club is a professional football club based in Swindon, Wiltshire, England. The team currently competes in EFL League Two, the fourth tier of the English football league system.",Swindon,England
6986,1445382,Burton Albion,"Burton Albion Football Club is a professional association football club in the town of Burton upon Trent, Staffordshire, England. The team compete in League One, the third tier of the English football league system. The club moved its home ground in 2005 to the Pirelli Stadium from Eton Park.",Burton upon Trent,England
8074,1445390,Portsmouth,"Portsmouth Football Club is an English professional association football club in Portsmouth, Hampshire. The club currently compete in EFL League One, the third tier of the English football league system. The club was founded on 5 April 1898 and home matches are played at Fratton Park. Portsmouth F.",Portsmouth,England
8121,1445395,Doncaster Rovers,"Doncaster Rovers Football Club is a professional association football club based in the town of Doncaster, South Yorkshire, England. The team compete in League Two, the fourth tier of the English football league system.",Doncaster,England
8174,1445398,Wimbledon,"Wimbledon Football Club was an English football club formed in Wimbledon, south-west London, in 1889 and based at Plough Lane  from 1912 to 1991. Founded as Wimbledon Old Centrals, the club were a non-League team for most of their history.",Wimbledon,England
240,1445399,Wigan,"Wigan Athletic Football Club is an English professional association football club based in Wigan, Greater Manchester, England. The team competes in the Championship, the second tier of the English football league system, having been promoted in the 2021-22 season.",Wigan,England
8100,1445401,Bristol Rovers,"Bristol Rovers F.C. are a professional football club in Bristol, England. They compete in League One, the third tier of the English football league system. They play home matches at the Memorial Stadium in Horfield, they have been competing there since 1996.",Bristol,England
8374,1445410,Lincoln City,"Lincoln City Football Club is a professional association football club based in the city of Lincoln, Lincolnshire, England. The team compete in EFL League One, the third tier of the English football league system.",Lincoln,England
9076,1448461,Farul,"FCV Farul Constanța, commonly known as Farul Constanța or simply as Farul, is a Romanian professional football club based in the city of Constanța, Constanța County, which currently plays in the Liga I.",Constanța,Romania
14543,1448514,Turris-Oltul,"AFC Turris-Oltul Turnu Măgurele, commonly known as Turris Turnu Măgurele, or simply Turris, was a Romanian professional football club based in Turnu Măgurele, Teleorman County. The team was founded as Voința Saelele in 1965 and was originally based in Saelele, Teleorman County.",Turnu Măgurele,Romania
701,1448565,Petrolul,"Asociația Club Sportiv Petrolul 52, commonly known as Petrolul Ploiești (Romanian pronunciation: [peˈtrolul ploˈjeʃtʲ]) or simply as Petrolul, is a Romanian professional football club based in Ploiești, Prahova County, which competes in the Liga II.",Ploiești,Romania
14377,1448583,U Craiova 1948,"U Craiova 1948, commonly known as FC U Craiova 1948 or FC U Craiova, is a Romanian professional football team based in Craiova, Dolj County, which competes in the Liga I.",Craiova,Romania
15700,1448597,Miercurea Ciuc,"Futball Klub Miercurea Ciuc, commonly known as FK Miercurea Ciuc (Hungarian: FK Csíkszereda) or simply Miercurea Ciuc (Romanian ).",Miercurea Ciuc,Romania
18784,1448600,CSM Slatina,"Clubul Sportiv Municipal Slatina, commonly known as CSM Slatina or simply Slatina, is a Romanian football club based in Slatina, Olt County, which competes in the Liga III.  The club was founded in 2009 as CSM Slatina, quickly obtaining two consecutive promotions to reach the Liga II in 2011.",Slatina,Romania
13146,1448604,Aerostar Bacau,"Clubul Sportiv Aerostar Bacău, commonly known as Aerostar Bacău or simply as Aerostar, is a Romanian professional football club from the city of Bacău, Bacău County, currently playing in the Liga III.",Bacău,Romania
13149,1448605,ASU Politehnica,"Asociația Sportivă Universitatea Politehnica Timișoara (Romanian pronunciation: [po.liˈteh.nika timiˈʃo̯ara]), commonly known as ASU Politehnica Timișoara, or simply as ASU Poli, is a Romanian professional football club based in the city of Timișoara, Timiș County, currently playing in the Liga II.",Timișoara,Romania
9639,1448606,Gloria Buzau,"Fotbal Club Buzău, commonly known as FC Buzău or simply as Buzău, is a Romanian football club based in the city of Buzău, Buzău County, which competes in the Liga II.",Buzău,Romania
13148,1448607,Slobozia,"Asociația Fotbal Club Unirea 04 Slobozia,, commonly known as AFC Unirea Slobozia or simply as Unirea Slobozia, is a Romanian football club based in Slobozia, Ialomița County, which competes in the Liga II.",Slobozia,Romania
12625,1448608,Metaloglobus,"Fotbal Club Metaloglobus București, commonly known as Metaloglobus București or simply as Metaloglobus, is a Romanian football club based in București, currently playing in the Liga II.",Bucharest,Romania
695,1448609,Pandurii,"Clubul Sportiv Pandurii Lignitul Târgu Jiu, commonly known as Pandurii Târgu Jiu or simply Pandurii, is a Romanian football club based in Târgu Jiu, Gorj County, which competes in the Liga III.",Târgu Jiu,Romania
13147,1448614,Resita,"Clubul Sportiv Muncitoresc Reșița, commonly known as CSM Reșița or simply as Reșița, is a Romanian football club based in Reșița, Caraș-Severin County, currently playing in the Liga III.",Reșița,Romania
12622,1448615,Ripensia Timisoara,"Fotbal Club Ripensia UVT Timișoara, commonly known as Ripensia Timișoara, or simply as Ripensia, is a Romanian professional football club based in Timișoara, Timiș County. It plays in the Liga II. The team was founded in 1928 by Dr. Lázár Kornél and folded after twenty years due to lack of funds.",Timișoara,Romania
7184,1448620,Universitatea Cluj,"Fotbal Club Universitatea Cluj, commonly known as Universitatea Cluj or simply as U Cluj, is a Romanian professional football club based in the city of Cluj-Napoca, Cluj County, that competes in the Liga II, the second tier of the Romanian league system.",Cluj-Napoca,Romania
9634,1448636,Dunarea Calarasi,"Asociația Fotbal Club Dunărea 2005 Călărași, commonly known as Dunărea Călărași (Romanian pronunciation: [ˈdunəre̯a kələˈraʃʲ]), is a Romanian professional football club from the city of Călărași, Călărași County.",Călărași,Romania
8497,1454990,Feirense,"Clube Desportivo Feirense, commonly known as CD Feirense or just Feirense, is a Portuguese football club based in Santa Maria da Feira. Founded on 18 March 1918, Feirense play in the LigaPro, the second tier of Portuguese football. Their chairman is Kunle Soname and their manager is Filipe Martins.",Santa Maria da Feira,Portugal
9707,1454994,Casa Pia,"Casa Pia Atlético Clube is a professional football club founded in 1920 and based in Lisbon, Portugal, that competes in the Liga Portugal 2. The club is named after Casa Pia, a Portuguese children's charity, and many of its athletes come from that institution.",Lisbon,Portugal
8741,1455000,Chaves,"Grupo Desportivo de Chaves, commonly known as Chaves (Portuguese pronunciation: [ˈʃavɨʃ] (listen)), is a Portuguese football club from Chaves currently playing in the LigaPro. They were founded in 1949 and currently play at Estádio Municipal de Chaves.",Chaves,Portugal
8835,1455001,Vizela,"Futebol Clube de Vizela is a Portuguese football club based in Vizela, Braga District. Founded in 1939, it currently plays in the Liga Portugal Bwin, holding home games at the Estádio do Futebol Clube de Vizela, with a capacity for 6,100 spectators.",Vizela,Portugal
9714,1455002,Cova da Piedade,"Clube Desportivo Cova da Piedade is a football club established in the parish of Cova da Piedade, municipality of Almada, Portugal.",Cova da Piedade,Portugal
9932,1455323,Menemen Belediyespor,"Menemenspor, formerly Menemen Belediyespor, is a Turkish professional football club located in the Menemen district of İzmir that competes in TFF First League. The club colours are blue and yellow and they play their home matches at Menemen İlçe Stadium.",İzmir,Turkey
8480,1455328,Balıkesirspor,"Balıkesirspor is a Turkish sports club based in Balıkesir. Established in 1966, the football team played in the Süper Lig after achieving promotion having finished as runners-up of the TFF First League in 2013–14. The team's previous promotion was 40 years before that.",Balıkesir,Turkey
8249,1455333,Altinordu,Altınordu Futbol Kulübü is a Turkish professional football club based in İzmir. It was founded in 1923 as a breakaway from Altay SK. Team colours are red and navy. The club also had a basketball team and played in Turkish Basketball League and Turkish Basketball Championship.,İzmir,Turkey
6967,1455337,Akhisar Belediyespor,"Akhisarspor Kulübü, commonly known as Akhisarspor, is a Turkish professional football club located in the city of Akhisar. Formed in 1970, Akhisarspor are nicknamed Akigo. The club has a fierce rivalry with Turgutluspor and Manisaspor.",Akhisar,Turkey
8800,1455338,Osmanlıspor,"Ankaraspor Kulübü, formerly known as Osmanlıspor (Turkish pronunciation: [ˈosmanɫɯspoɾ]), is a Turkish professional football club based in the country's capital Ankara. It competes in the TFF First League.",Ankara,Turkey
11136,1455339,Umraniyespor,"Ümraniyespor is a Turkish professional football club located in Ümraniye, Istanbul. The club plays in red and white kits, and have done so since their formation in 1938.",Ümraniye,Turkey
8535,1459232,Krystal Kherson,Krystal Kherson is a professional football club from Kherson in Ukraine that has a long history in the Soviet and then the Ukrainian Leagues.,Kherson,Ukraine
10693,1459289,Prykarpattia,FC Prykarpattia Ivano-Frankivsk is a professional Ukrainian football from Ivano-Frankivsk. The club competes in the Ukrainian First League. The club has been reformed based on FC Teplovyk Ivano-Frankivsk that existed since 1998.," Ivano-Frankivsk",Ukraine
7317,1459290,Mykolaiv,MFС Mykolaiv is a Ukrainian football club based in Mykolaiv. It is one of the oldest football clubs that exists in Ukraine.,Mykolaiv,Ukraine
8366,1459321,Hirnyk-Sport,"FC Hirnyk-Sport Horishni Plavni is a Ukrainian football club based in Horishni Plavni, Poltava Oblast. The club competes in the First League. The club is sponsored by Ferrexpo.",Horishni Plavni,Ukraine
12433,1459330,Polessya,"FC Polissya Zhytomyr  is a Ukrainian football club based in Zhytomyr, Polesia. As of the 2020–21 season, it will play in the Ukrainian First League, the second tier of Ukrainian football, following promotion from the 2019–20 Ukrainian Second League. Their home were Spartak and Kolos stadiums.",Zhytomyr,Ukraine
7156,1459333,Kramatorsk,Football Club Kramatorsk is a professional Ukrainian football club from the city of Kramatorsk in Donetsk Oblast. The club takes its history from a factory team of the Old Kramatorsk Machine-building Plant (SKMZ).,Kramatorsk,Ukraine
14522,1475113,Potenza,"Potenza Calcio S.r.l., formerly A.S.D. Rossoblù Potenza F.C. or just Potenza F.C., is an Italian football club based in Potenza, Basilicata. It currently plays in the Serie C. Potenza Calcio was founded in June 2012 as F.C.D.",Potenza,Italy
11499,1475119,Pro Sesto,"Pro Sesto 1913 S.r.l. is an association football club, based in Sesto San Giovanni, Lombardy, Italy. Pro Sesto currently plays in Serie C, having last been in Serie B in 1950.",Sesto San Giovanni,Italy
10861,1475210,Olbia,"Olbia Calcio 1905 S.r.l. is an Italian association football club, based in Olbia, Sardinia, and currently playing in Serie C.",Olbia,Italy
11492,1475214,Ravenna,"Ravenna Football Club is an Italian association football club, based in Ravenna, Emilia-Romagna. It currently plays in Serie C after achieving promotion as Group D champions in the 2016-17 Serie D season. The club was founded in 1913.",Ravenna,Italy
15087,1475234,Pergolettese,"Unione Sportiva Pergolettese 1932 is an Italian association football club, based in Crema, province of Cremona, Lombardy. It currently plays in Serie C, the third level of Italian football.",Crema,Italy
8259,1475235,Pistoiese,"Unione Sportiva Pistoiese 1921 is an Italian association football club, based in Pistoia, Tuscany. Currently, Pistoiese plays in Serie C.",Pistoia,Italy
8484,1475260,Renate,"Associazione Calcio Renate is an Italian association football club based in Renate, Lombardy. It currently plays in Serie C. The club plays their home games at the Stadio Città di Meda in Meda instead of their home field, Stadio Mario Riboldi in Renate, to comply with Lega Pro stadium criteria.",Renate,Italy
7323,1475268,Modena,"Modena Football Club 2018, commonly referred to as Modena, is an Italian football club based in Modena, Emilia-Romagna. The club was founded in 1912, and refounded in 2018, and had spent the majority of its existence playing in Serie B.",Modena,Italy
7632,1475277,Avellino,"Unione Sportiva Avellino 1912, commonly known as US Avellino, is an Italian professional football club based in Avellino, Campania. It competes in Serie C, the third tier of Italian football.",Avellino,Italy
8193,1475285,Como,"Como 1907, commonly referred to as Como, is an Italian football club based in Como, Lombardy, Italy. The club currently plays in Serie B, the second tier of Italian football, following promotion from the 2020–21 Serie C season. The club was founded in 1907, and the team's colour is royal blue.",Como,Italy
8240,1475288,Pro Patria,"Aurora Pro Patria 1919, commonly referred to as Pro Patria, is an Italian football club based in Busto Arsizio, Lombardy. It currently plays in Serie C.  In Latin, Pro Patria translates to ""For the Fatherland"".",Busto Arsizio,Italy
11219,1475295,Fano,"Alma Juventus Fano 1906, commonly known as Fano, is an Italian association football club located in Fano, Marche.  The club currently plays in Serie D, the fourth tier of Italian football.",Fano,Italy
8256,1475297,Mantova,"Mantova 1911 Società a Responsabilità Limitata, commonly referred to as Mantova, is an Italian football club based in Mantua (Italian: Mantova), Lombardy. Mantova had played consecutively in the Italian Serie B from the 2005–06 season to 2009–10 as Associazione Calcio Mantova (A.C.",Mantua,Italy
10648,1475299,Sambenedettese,"A.S. Sambenedettese S.r.l. is an Italian association football club, based in San Benedetto del Tronto, Marche. Sambenedettese currently plays in Serie D.",San Benedetto del Tronto,Italy
11263,1475300,Gubbio,"Associazione Sportiva Gubbio 1910 is an Italian association football club, based in Gubbio, Umbria. The club play in Serie C, the third tier of Italian football.",Gubbio,Italy
7793,1475301,Südtirol,"Fußball Club Südtirol is an Italian association football club, based in the city of Bolzano, in the autonomous province South Tyrol. The club was formerly known as its bilingual name F.C. Südtirol – Alto Adige.",Bolzano,Italy
8547,1475303,Imolese,"Imolese Calcio 1919 is an Italian football club based in Imola, Emilia-Romagna. Currently it plays in Italy's Serie C.",Imola,Italy
7164,1475304,Padova,"Calcio Padova, commonly referred to as Padova, is an Italian football club based in Padua, Veneto. Founded in 1910, Padova currently play in Serie C Group A, having last been in Serie A in 1996. The team's official colours are white and red.",Padua,Italy
9664,1475307,Monopoli,"Società Sportiva Monopoli 1966 is an Italian association football club located in Monopoli, Apulia. They currently play in Serie C, the third tier of Italian football.",Monopoli,Italy
10889,1475308,AS Viterbese Castrense,"Unione Sportiva Viterbese 1908, commonly known as Viterbese, is an Italian football club, based in Viterbo, Lazio. Viterbese currently plays in Serie C, the third tier of Italian football.",Viterbo,Italy
8258,1475309,Catanzaro,"U.S. Catanzaro 1929 is an Italian football club based in Catanzaro, Calabria and competes in Serie C, the third tier of the Italian soccer championship. The club was initially formed with the merger of two locals clubs in 1927 before being officially founded in 1929.",Catanzaro,Italy
8574,1475313,Pontedera,"Unione Sportiva Città di Pontedera is an Italian association football club located in Pontedera, Tuscany. Currently it plays in Serie C, the third tier of Italian football.",Pontedera,Italy
9148,1475314,Carrarese,"Carrarese Calcio 1908, commonly referred to as Carrarese, is an Italian football club based in Carrara, Tuscany. It currently plays in Serie C, having last been in Serie B in 1948.",Carrara,Italy
8192,1475315,Piacenza,"Piacenza Calcio 1919, commonly referred to as Piacenza, is an Italian football club based in Piacenza, Emilia-Romagna. The club currently plays in Serie C. Re-founded in 2012, Piacenza Calcio 1919 acquired the rights to use the brand of the original club Piacenza Calcio (also known as Piacenza F.C.",Piacenza,Italy
7238,1475316,Pro Vercelli,"Football Club Pro Vercelli 1892, commonly referred to as Pro Vercelli, is an Italian football club based in Vercelli, Piedmont. The club is mostly renowned as one of the most successful teams in the early football era of Italy, with seven national titles (all won between 1908 and 1922).",Vercelli,Italy
8841,1475317,AlbinoLeffe,"Unione Calcio AlbinoLeffe is an Italian association football club representing Albino and Leffe, two small towns located in Val Seriana, Lombardy. The club played in Serie B for nine consecutive years and narrowly missed promotion in Serie A at the end of the 2007–08 season.",Val Seriana,Italy
7286,1475320,Grosseto,"Unione Sportiva Grosseto 1912 is an Italian association football club, based in the city of Grosseto, Tuscany. The club was founded in 1912 as Unione Ginnico Sportiva Grossetana. The team's most associated nickname is grifone, after its logo, depicting a griffon.",Grosseto,Italy
8246,1475321,Lucchese,"Lucchese 1905 s.r.l., or simply Lucchese, is an Italian football club, based in Lucca, Tuscany that plays in Serie C, the third tier of Italian football. The club was first founded in 1905, having last been in Serie A in 1952.",Lucca,Italy
8471,1475323,FeralpiSalo,"Feralpisalò is an Italian association football club located in Salò, Lombardy, and representing also the nearby town of Lonato del Garda, Lombardy. The club currently play in Serie C, the third tier of Italian football.",Lonato del Garda,Italy
8537,1475324,Fermana,"Fermana Football Club is an Italian association football club based in Fermo, Marche. The club currently play in Serie C, the third tier of Italian football after achieving promotion by winning Group F in the 2016-17 Serie D season.",Fermo,Italy
