12660,1504041,Lija Athletic,"Lija Athletic Football Club is a football team originating from the village of Lija, Malta. The present club was founded in 1949 and has competed in the Maltese Premier League five times.",Lija,Malta
11293,1504044,Gzira United,"Gżira United Football Club is a Maltese professional football club from the small harbor town of Gżira in central Malta, which currently plays in the Maltese Premier League.",Gżira,Malta
14016,1505702,Americano,"Americano Futebol Clube, or Americano as they are usually called, is a Brazilian football team from Campos dos Goytacazes in Rio de Janeiro, founded on June 1, 1914. They play in black and white stripes, black shorts and socks.",Rio de Janeiro,Brazil
8047,1505883,CD Guadalajara,"Club Deportivo Guadalajara; often simply known as Guadalajara ([ɡwaðalaˈxaɾa]) and their nickname Chivas ([ˈtʃiβas]), is a Mexican professional football club based in Zapopan, Jalisco.",Zapopan,Mexico
18593,1505887,Mazatlan,"Mazatlán Futbol Club is a Mexican professional football team based in Mazatlán, Sinaloa currently playing in Liga MX. The club was established in June 2020 after the Monarcas Morelia franchise announced that it would be moving to the city of Mazatlán.",Mazatlán,Mexico
13468,1505888,Atletico de San Luis,"Club Atlético de San Luis, commonly known as Atlético San Luis, is a Mexican professional football club based in San Luis Potosí, replacing San Luis Potosí's Liga MX team San Luis FC after its relocation. San Luis was promoted to Liga MX in 2019.",San Luis Potosí,Mexico
18741,1506629,Cancun,"Cancún Futbol Club is a Mexican professional football team based in Cancún, Quintana Roo currently playing in Liga de Expansión MX. The club was established in June 2020 after the Cafetaleros de Chiapas franchise announced that it would be moving to the city of Cancún.",Cancún,Mexico
18738,1506637,Tlaxcala,"Tlaxcala Fútbol Club, commonly known as Coyotes de Tlaxcala, is a Mexican football club based in Tlaxcala. The club was founded in 2014, and currently plays in the second tier, Liga de Expansión MX.",Tlaxcala,Mexico
12541,1506640,Leones Negros,"Club Leones Negros de la Universidad  de Guadalajara, also known as Leones Negros,  Leones Negros UdeG, Universidad de Guadalajara,  or UdeG, is a football club that currently plays in the Liga de Expansión MX.",Guadalajara,Mexico
18739,1506642,Pumas Tabasco,"Pumas Tabasco is a Mexican professional football team based in Villahermosa, it is currently a member of the Liga de Expansión MX. It is an affiliated team of Club Universidad Nacional, team that plays in Liga MX.",Villahermosa,Mexico
12545,1506644,Mineros de Zacatecas,Club Deportivo Mineros de Zacatecas is a Mexican football club from Zacatecas that compete in the Mexican Liga de Expansión MX. They are currently managed by Omar Alexis Moreno.,Zacatecas,Mexico
18737,1506645,Tapatio,Club Deportivo Tapatío is the official reserve team of C.D. Guadalajara. It was dissolved in 2009 and has been replaced by Chivas Rayadas de Guadalajara before its own dissolution in 2019. In 2020 the team was reactivated for its participation in the Liga de Expansión MX.,Guadalajara,Mexico
9525,1506646,Dorados de Sinaloa,"Dorados de Sinaloa, or Dorados, is a Mexican professional soccer club based on Culiacán, Sinaloa, Mexico.",Culiacán,Mexico
12542,1506647,Cimarrones de Sonora,"The Cimarrones de Sonora Fútbol Club is Mexican football club that plays in the Liga de Expansión MX. The club is based in Hermosillo, Sonora, Mexico.",Hermosillo,Mexico
11326,1506648,Morelia,"Club Atlético Morelia is a Mexican football club based in Morelia, Michoacán. Founded on 4 June 1950, the club currently plays in the Liga de Expansión MX. The club play their home games at Estadio Morelos.",Morelia,Mexico
12546,1506649,Alebrijes de Oaxaca,"Alebrijes de Oaxaca Fútbol Club is a Mexican football team based in the city of Oaxaca, state of Oaxaca. They play in the second tier of Mexican football league, Liga de Expansión MX.",Oaxaca,Mexico
13463,1506650,Venados,"Venados Fútbol Club is a Mexican football club based in Mérida, Yucatán. The team are currently playing in the Liga de Expansión MX, the second tier of the Mexican football league system.",Mérida,Mexico
12515,1506835,Deportes Valdivia,"Deportes Valdivia is a Chilean football club in the town of Valdivia, Chile. It currently plays in Segunda División, the third level of Chilean football.The club was founded on June 5, 1983, and re-founded on December 19, 2003.",Valdivia,Chile
12511,1506837,Magallanes,"Deportes Magallanes is a Chilean Football team based in San Bernardo, Chile. They currently play at the second level of Chilean football, the Primera B de Chile. The club was founded on October 27, 1897 with the name Atlético Escuela Normal F.C.",San Bernardo,Chile
12512,1506841,Nublense,"Deportivo Ñublense S.D.A.P is a professional football team based in Chillán, Ñuble Region, Chile. The club was formed in 1916 under the name of Liceo Fútbol Club. They compete in Chile's Primera División league.",Chillán,Chile
14945,1506842,Deportes Santa Cruz,"Club de Deportes Santa Cruz is a football club based in Santa Cruz, Chile. The club currently plays in the Chilean Primera Division B, the second tier of Chilean football. The club was founded  on May 25, 1913 as Unión Comercio.",Santa Cruz,Chile
12510,1506845,Barnechea,"Athletic Club Barnechea is a Chilean Football club based in the Lo Barnechea commune of Santiago, Chile. They currently play in the second level of Chilean football, the Primera B.",Santiago,Chile
13518,1506927,Magra,"Nedjm Chabab Magra, known as NC Magra or NCM for short, is an Algerian football club based in the city of Magra in the M'Sila Province. The club was founded in 1998 and its colours are Blue and white. Their home stadium, the Boucheligue Brothers Stadium, has a capacity of 5,000 spectators.",Magra,Algeria
11268,1506930,CR Belouizdad,"Chabab Riadhi de Belouizdad S.s.p.a, known as Chabab Belouizdad or CR Belouizdad or simply CRB for short, is an Algerian association football club based in Algiers, Algeria, that plays in the Ligue Professionnelle 1, the top flight of Algerian football.",Algiers,Algeria
8622,1506933,USM Bel Abbes,"Union Sportive Medinat Bel Abbès, known as USM Bel Abbès or simply USMBA for short, is an Algerian football club located in Sidi Bel Abbès, Algeria, that was founded in 1933 and its colors are green and red. Their home stadium, 24 February 1956 Stadium, has a capacity of 45,000 spectators.",Sidi Bel Abbès,Algeria
12540,1506958,Pars Jonoubi Jam,"Football Club Pars Jonoubi Jam, commonly known as Pars Jonoubi Jam, is an Iranian football club based in Jam, Bushehr. They were promoted to the Persian Gulf Pro League in 2016–17 season. The football team plays their home games at the Shohada Stadium which has a seating capacity of 15,000.",Jam,Iran
9402,1507246,Municipal,"Club Social y Deportivo Municipal, also known as the Municipal or Los Rojos (the Reds), is a Guatemalan football club based in Guatemala City. They compete in the Liga Nacional, the top tier of Guatemalan football, and play their home matches at the Estadio El Trébol.",Guatemala City,Guatemala
14197,1507332,San Carlos,"Asociación Deportiva San Carlos is a Costa Rican football team based in Ciudad Quesada, the capital of San Carlos, Alajuela. They currently play in the Costa Rican First Division. Their home stadium is Estadio Carlos Ugalde Álvarez.",Ciudad Quesada,Costa Rica
9767,1507334,Herediano,"Club Sport Herediano, commonly known as Herediano and nicknamed El Team, is a Costa Rican multisport club based in the district of San Francisco, Heredia province. Although they compete in a number of different sports, Herediano is mostly known for its association football team.",San Francisco,Costa Rica
12675,1507548,Podgorica,"Fudbalski klub Podgorica, formerly known as OFK Mladost 1970, is a football club from the southwestern part of Podgorica, Montenegro. It was founded in 1970, the club was reactivated during 2014. In the summer 2019, the club was renamed to FK Podgorica.",Podgorica,Montenegro
9082,1507563,Petrovac,"OFK Petrovac is a football club based in Petrovac, Montenegro. They currently compete in the First League of Montenegro.",Petrovac,Montenegro
7969,1507564,OFK Titograd,"OFK Titograd is a professional football club based in Podgorica, Montenegro. Founded in 1951, they play in the Third League of Montenegro. The team has one league trophy and two Montenegrin Cup trophies. OFK Titograd is a member of the European Club Association.",Podgorica,Montenegro
8012,1507566,Sutjeska,"Fudbalski klub Sutjeska is football club from Nikšić, Montenegro, currently competing in the Montenegrin First League. The club was established in 1920, and has been known by its current name since 1945.",Nikšić,Montenegro
24,1507855,Botafogo SP,"Botafogo Futebol Clube, commonly referred to as Botafogo-SP, Botafogo de Ribeirão Preto or simply Botafogo, is a Brazilian association football club in Ribeirão Preto, São Paulo.",Ribeirão Preto,Brazilia
7235,1507858,Ituano,"Ituano Futebol Clube, commonly referred to as simply Ituano, is a Brazilian association football club in Itu, São Paulo. They currently play in the Série B, the second tier of Brazilian football, as well as in the Campeonato Paulista Série A1, the top flight of the São Paulo state football league.",Itu,Brazil
10089,1507859,Santo Andre,"Esporte Clube Santo André, commonly referred to as simply Santo André, is a Brazilian association football club in Santo André, São Paulo. They currently play in the Série D, the fourth tier of Brazilian football, as well as in the Campeonato Paulista, São Paulo's premier state league.",Santo André,Brazil
7168,1507863,Guarani Campinas,"Guarani Futebol Clube, colloquially called Guarani, is a Brazilian association football club in Campinas, São Paulo. Guarani is the only club from Brazil's countryside to have won the top tier of the Brazilian Championship.",Campinas,Brazilia
13734,1507864,Inter de Limeira,"Associação Atlética Internacional, commonly referred to as simply Inter de Limeira, is a Brazilian association football club in Limeira, São Paulo.  They currently play in the Série D, the fourth tier of Brazilian football, as well as in the Campeonato Paulista, São Paulo's premier state league.",Limeira,Brazil
7170,1507869,São Caetano,"Associação Desportiva São Caetano, commonly referred to as São Caetano, is a Brazilian professional club based in São Caetano do Sul, São Paulo founded on 4 December 1989. It competes in the Campeonato Paulista Série A2, the second tier of the São Paulo state football league.",São Caetano do Sul,Brazil
7088,1507871,Red Bull Bragantino,"Red Bull Bragantino, commonly known as Bragantino, is a Brazilian football club based in Bragança Paulista, São Paulo.",Bragança Paulista,Brazil
8910,1507880,Novorizontino,"Grêmio Esportivo Novorizontino, usually known simply as Novorizontino was a Brazilian football club from Novo Horizonte, São Paulo state.",São Paulo,Brazil
7091,1507957,Botafogo RJ,"Botafogo de Futebol e Regatas, also known as Botafogo, is a Brazilian sports club based in the bairro (neighborhood) of Botafogo, in the city of Rio de Janeiro. Although they compete in a number of different sports, Botafogo is mostly known for its association football team.",Rio de Janeiro,Brazil
7296,1507970,Flamengo,"Clube de Regatas do Flamengo, more commonly referred to as simply Flamengo, is a Brazilian sports club based in Rio de Janeiro, in the neighborhood of Gávea, best known for their professional football team.",Rio de Janeiro,Brazil
10042,1507971,Volta Redonda,"Volta Redonda Futebol Clube, commonly referred to as Volta Redonda, is a Brazilian professional club based in Volta Redonda, Rio de Janeiro founded on 9 February 1976.",Volta Redonda,Brazil
10070,1507973,Bangu,"Bangu Atlético Clube, commonly known as Bangu, is a Brazilian professional association football club based in Rio de Janeiro, in the western neighbourhood of Bangu.",Rio de Janeiro,Brazil
11441,1507974,Boavista Saquarema,"Boavista Sport Club, commonly known as Boavista, is a Brazilian professional football club in  Saquarema, Rio de Janeiro. The team compete in Campeonato Carioca, the top tier of the Rio de Janeiro state football league.The club was formerly known as Esporte Clube Barreira."," Saquarema",Brazil
7097,1508071,Atlético Mineiro,"Clube Atlético Mineiro, commonly known as Atlético Mineiro or Atlético, and colloquially as Galo (pronounced [ˈgalu], ""Rooster""), is a professional football club based in the city of Belo Horizonte, the capital city of the Brazilian state of Minas Gerais.",Belo Horizonte,Brazil
8275,1508075,URT,"União Recreativa dos Trabalhadores, commonly known as URT, is a Brazilian football club based in Patos de Minas, Minas Gerais state. They competed in the Copa do Brasil three times.",Patos de Minas,Brazil
11409,1508090,Uberlandia,"Uberlândia Esporte Clube, usually known simply as Uberlândia, is a Brazilian football team, from the city of Uberlândia, in Minas Gerais State. The club plays their home games at Estádio Parque do Sabiá. The club was founded in 1922.",Uberlândia,Brazil
13857,1508208,Alagoano,"Centro Sportivo Alagoano, commonly referred to as CSA, is a Brazilian professional football club based in Maceió, Alagoas. It competes in the Série B, the second tier of Brazilian football, as well as in the Campeonato Alagoano, the top flight of the Alagoas state football league.",Maceió,Brazil
11437,1508895,Brusque,"Brusque Futebol Clube, commonly referred to as Brusque, is a Brazilian professional club based in Brusque, Santa Catarina founded on 12 October 1987.",Brusque,Brazil
16344,1508923,Juventus SC,"Grêmio Esportivo Juventus, commonly known as Juventus or Juventus-SC, is a Brazilian football club based in Jaraguá do Sul, Santa Catarina state. They competed twice in the Série C.",Jaraguá do Sul,Brazil
8847,1509039,Chennaiyin,"Chennaiyin Football Club is an Indian professional football club based in Chennai, Tamil Nadu. The club competes in the Indian Super League, the top flight of Indian football. The club was founded in August 2014 during the inaugural season of the Indian Super League.",Chennai,India
13241,1509043,Kerala Blasters,"Kerala Blasters Football Club, commonly referred to as The Blasters, is an Indian professional football club based in Kochi, Kerala, that competes in the Indian Super League, the top tier of football in India.",Kochi,India
9036,1509047,Bengaluru,"Bengaluru Football Club is an Indian professional football club based in Bangalore, Karnataka. The club competes in the Indian Super League, the top flight of Indian football.",Bangalore,India
7587,1509049,East Bengal,"East Bengal Club is an Indian professional football club based in the city of Kolkata, West Bengal. Founded in 1920, the club competes in the Indian Super League, the top flight of Indian football, as well as the Calcutta Premier Division A, the oldest football league in Asia.",Kolkata,India
9058,1509052,Villa San Carlos,"Club Social y Deportivo Villa San Carlos is an Argentine football club from the city of Berisso (nearly La Plata) in Buenos Aires Province. The team currently plays in the Primera B Metropolitana, the regionalised third level of the Argentine football league system.",Buenos Aires,Argentine
7557,1509871,La Equidad,"Club Deportivo La Equidad Seguros, also known as La Equidad, is a professional Colombian football team based in Bogotá, that currently plays in the Categoría Primera A. They play their home games at the Metropolitano de Techo stadium.",Bogotá,Colombia
7553,1509880,Once Caldas,"Once Caldas S.A., simply known as Once Caldas, is a professional Colombian football team based in Manizales, that currently plays in the Categoría Primera A. They play their home games at the Palogrande stadium. They were the surprise winners of the Copa Libertadores in 2004.",Manizales,Colombia
7814,1509885,Millonarios,"Millonarios Fútbol Club is a professional Colombian football team based in Bogotá, that currently plays in the Categoría Primera A. They play their home games at the El Campín stadium. Millonarios, was initially created in 1937 by students from the Colegio Mayor de San Bartolomé.",Bogotá,Colombia
8302,1510479,Ferro,"Club Ferro Carril Oeste, known simply as Ferro Carril Oeste or familiarly, Ferro, is an Argentine sports club from the neighbourhood of Caballito, Buenos Aires.",Caballito,Argentine
7730,1510491,Olimpo Bahía Blanca,"Club Olimpo, usually referred to as Olimpo de Bahía Blanca, is an Argentine sports club based in the city of Bahía Blanca, Buenos Aires Province. The club was founded October 15th, 1910. Its primary activity is soccer. The club is recognized in Argentina's highest soccer league.",Bahía Blanca,Argentine
12790,1510527,Canuelas,"Cañuelas Fútbol Club is an Argentine football club from the city of Cañuelas in Buenos Aires Province. The team currently plays in Primera C Metropolitana, the fourth division of the Argentine football league system.",Buenos Aires,Argentine
8949,1510866,Real Cartagena,"Real Cartagena is a professional Colombian football team based in Cartagena, that currently plays in the Categoría Primera B. They play their home games at the Jaime Morón León stadium.",Cartagena,Colombia
11081,1510902,Orsomarso,Orsomarso Sportivo Clube is a Colombian professional football team based in Palmira founded in 2016. The team currently plays in the Categoría Primera B and plays its home games at the Francisco Rivera Escobar stadium. Its name comes from the Italian comune Orsomarso.,Palmira,Colombia
9057,1510912,Barranquilla,"Barranquilla Fútbol Club is a professional Colombian football team based in Barranquilla, that currently plays in the Categoría Primera B. They play their home games at the Estadio Romelio Martínez.",Barranquilla,Colombia
10072,1510922,Union Magdalena,"Unión Magdalena commonly known as El Unión, and nicknamed as El Ciclón Bananero (The Banana Cyclone), is a professional Colombian football club based in Santa Marta, Magdalena, Colombia.",Santa Marta,Colombia
11513,1510943,Fortaleza Cota,"Fortaleza C.E.I.F. is a professional Colombian football team based in Cota, in the Cundinamarca Department, currently playing in the Categoría Primera B. The team has been promoted to the Categoría Primera A twice, in 2013 and 2015.",Cota,Colombia
9612,1510944,Leones,"Leones F.C., also known as Itagüí Leones, is a professional Colombian football team based in Itagüí playing in the Categoría Primera B starting from 2019. They play their home games at the Estadio Metropolitano Ciudad de Itagüí.",Itagüí,Colombia
7876,1510992,Giravanz Kitakyushu,"Giravanz Kitakyushu is a Japanese football club based in Kitakyushu, Fukuoka Prefecture. They currently play in the third tier of Japanese football as they were relegated after the 2021 season.",Kitakyushu,Japan
7444,1511460,Winterthur,"FC Winterthur is a Swiss football club based in Winterthur, Canton of Zürich. They play in the Swiss Challenge League, the second tier of Swiss football, and appeared regularly in the Nationalliga A during the 20th century. Their home is the Stadion Schützenwiese.",Winterthur,Switzerland
574,1511461,Thun,"FC Thun is a Swiss football team from the Bernese Oberland town of Thun. The club plays in the Swiss Challenge League after being relegated in the 2019–20 Swiss Super League. The club plays at the Stockhorn Arena which accommodates a total of 10,000 supporters, both seated and standing.",Thun,Switzerland
8520,1511576,Al Ittihad Alexandria,"Al Ittihad Alexandria Club, simply known as Al Ittihad, is an Egyptian sports club based in Alexandria, Egypt. The club is mainly known for its professional football team, which currently plays in the Egyptian Premier League, the highest league in the Egyptian football league system.",Alexandria,Egypt
8752,1511599,Pyramids,"Pyramids Football Club, is an Egyptian football club based in Cairo that currently plays in the Egyptian Premier League, the highest league in the Egyptian football league system.  Formed in 2008 as Al Assiouty Sport in Beni Seuf, the club was bought and moved to Cairo in 2018.",Cairo,Egypt
6903,1511615,Al Ahly Cairo,"Al Ahly Sporting Clubl Ahly Sporting Club (Arabic: النادي الأهلي للرياضة البدنية, literal translation: The National Club,  commonly referred to as Al Ahly, is an Egyptian professional sports club based in Cairo.",Cairo,Egypt
11287,1512138,Al Faisaly Harmah,"Al-Faisaly FC is a Saudi Arabian football team based in Harmah City, playing in the Saudi Professional League. The club is named after King Faisal (r. 1964–75); he was crown prince at the time of the club's founding.",Harmah City,Saudi Arabia
7017,1512139,Al-Shabab Riyadh,"Al-Shabab Football Club is a Saudi Arabian professional football club based in Riyadh. It was founded in 1947, and was at first named Shabab Al Riyadh. (شباب الرياض), but in 1967 was renamed Al Shabab.",Riyadh,Saudi Arabia
13105,1512140,Dhamk,"Damac Football Club is a Saudi Arabian professional sports club based in Khamis Mushait, that currently competes in the Saudi Professional League, the top division of Saudi Arabian football. Founded in 1972, their home venue is Prince Sultan bin Abdul Aziz Stadium.",Khamis Mushait,Saudi Arabia
8976,1512142,Al Nasr Riyadh,"Al-Nassr Football Club is a Saudi Arabian football club based in Riyadh. Formed in 1955, the club plays its home games at the Mrsool Park. Their home colours are yellow and blue.",Riyadh,Saudi Arabia
11286,1512144,Al Taawon Buraidah,"Al Taawoun Football Club is a professional football club based in Buraidah that plays in the Saudi Professional League, the top tier of Saudi Football. Al-Taawoun have won the King Cup once, in 2019, defeating Al-Ittihad in the final.",Buraidah,Saudi Arabia
8441,1512148,Al-Fateh,"Al-Fateh Sports Club is a Saudi Arabian multi-sports club based in Al-Mubarraz, Al-Ahsa. It is mainly known for its professional football club. Its nickname, ""Al-Namothaji"" (the model), is due to the fact that almost all of the club's sports play in the national top flights.",Al-Mubarraz,Saudi Arabia
11289,1512150,Al Baten,"Al-Batin Football Club is a Saudi Arabian professional football club based in Hafar al-Batin, Eastern Province, that competes in the Saudi Professional League. The club was founded in 1979. Al-Batin's colours are sky blue and black.",Hafar al-Batin,Saudi Arabia
8953,1512151,Al-Wahda Mecca,"Al-Wehda FC is a multi-sports club from Mecca, Saudi Arabia, founded in 1945, making it the third oldest club in Saudi Arabia. The football section plays in the Saudi Professional League. They also have a handball section.",Mecca,Saudi Arabia
12516,1512733,Deportes Puerto Montt,"Club Deportes Puerto Montt is a Chilean football club based in the city of Puerto Montt, Los Lagos Region. The club was founded on May 6, 1983, and currently plays in the Primera B de Chile, the second division of the country.",Puerto Montt,Chile
11231,1512782,Hatta,"Hatta Club is a sports club based in Hatta in the Emirate of Dubai, UAE, founded in 1981. It is most widely known for its professional football team, which currently plays in the UAE Pro League.",Hatta,United Arab Emirates
8742,1512786,Al-Ittihad Kalba,"Ittihad Kalba Sports &amp; Cultural Club is a football club in Kalba, United Arab Emirates.",Kalba,United Arab Emirates
8204,1512788,Al-Wasl,"Al Wasl Football Club is an Emirati professional football club based in Dubai, that competes in the United Arab Emirates Football League. It is a part of the multi-sports club Al Wasl SC. Argentina-legend Diego Maradona was the manager of the club in 2011 and 2012.",Dubai,Emirates
10071,1512790,Al Khaleej Khor Fakkan,"Khor Fakkan Club, usually known simply as Khor Fakkan, is an Emirati football club from Khor Fakkan. Founded in 1981, the club won a UAE Federation Cup in the 1993–94 season. In June 2017 the club was rebranded with a new name and logo now it is known as Khor Fakkan.",Khor Fakkan,United Arab Emirates
8293,1512791,Al Sharjah,Sharjah Football Club is an Emirati professional football club based in Sharjah that competes in the UAE Pro League. Their home stadium is Sharjah Stadium.,Sharjah,Emirati
8745,1512793,Al Wahda Abu Dhabi,"Al Wahda Football Club is an Emirati professional football club based in Abu Dhabi, that competes in the UAE Pro League. The club was founded in 1974 and plays its home games at the Al-Nahyan Stadium. The club's colours are maroon, grey and white.",Abu Dhabi,Emirates
9245,1513136,Defensores de Belgrano,"Club Atlético Defensores de Belgrano is an Argentine sports club from Nuñez, Buenos Aires. The club is mostly known for its football team, which currently plays in Primera Nacional, the regionalised second division of the Argentine league system.",Nuñez,Argentine
7681,1515920,Platense,"Club Atlético Platense is an Argentine sports club based in Florida, Buenos Aires. The club nickname is Calamar (Squid) after the journalist Palacio Zino said that the team moved ""like a squid in its ink"".Although the club hosts many activities, Platense is mostly known for its football team.",Florida,Argentine
13694,1516284,Tochigi,"Tochigi Soccer Club, commonly referred to as Tochigi SC are a football club based in Utsunomiya, Tochigi Prefecture, Japan. They currently play in the J2 League.",Utsunomiya,Japan
13727,1516293,Sagamihara,"SC Sagamihara is a Japanese association football club based in Sagamihara, Kanagawa Prefecture. They currently play in the third tier of Japanese football J3 League.",Sagamihara,Japan
